{
  "schemaVersion": 2,
  "name": "chart/meter",
  "type": "chart",
  "description": "Progress meter in bar or gauge variant with threshold coloring.",
  "version": "0.0.0",
  "files": [],
  "dependencies": [
    "@cascade-ui/charts"
  ],
  "tags": [
    "chart",
    "meter",
    "gauge",
    "progress",
    "data-viz"
  ],
  "category": "chart",
  "install": "@cascade-ui/charts",
  "meta": {
    "name": "Meter",
    "description": "Progress meter in bar or gauge variant with threshold coloring.",
    "category": "chart",
    "states": [],
    "variants": [
      "bar",
      "gauge"
    ],
    "sizes": [],
    "props": [
      {
        "name": "value",
        "type": "number",
        "required": true,
        "description": "Current value"
      },
      {
        "name": "label",
        "type": "string",
        "required": true
      },
      {
        "name": "min",
        "type": "number",
        "required": false,
        "default": "0"
      },
      {
        "name": "max",
        "type": "number",
        "required": false,
        "default": "100"
      },
      {
        "name": "variant",
        "type": "'bar' | 'gauge'",
        "required": false,
        "default": "bar"
      },
      {
        "name": "thresholds",
        "type": "MeterThresholds",
        "required": false,
        "description": "Color breakpoints"
      },
      {
        "name": "width",
        "type": "number",
        "required": false
      },
      {
        "name": "height",
        "type": "number",
        "required": false
      }
    ],
    "tokens": [
      "--cascade-chart-1"
    ],
    "accessibility": {
      "role": "meter",
      "wcag": "AA",
      "keyboard": []
    },
    "examples": [
      {
        "title": "Basic meter",
        "code": "import { Meter } from '@cascade-ui/charts'\n\n<Meter value={72} label=\"CPU usage\" />"
      }
    ],
    "dependencies": [
      "@cascade-ui/charts"
    ],
    "tags": [
      "chart",
      "meter",
      "gauge",
      "progress",
      "data-viz"
    ],
    "intent": {
      "whenToUse": [
        "Showing a rated or gauged value within a known min/max range",
        "Surfacing threshold-based status (e.g. CPU, disk, score) as a bar or gauge"
      ],
      "whenNotToUse": [
        "Showing task completion progress — use a ProgressBar",
        "Comparing a value against a target with range bands — use Bullet"
      ],
      "antiPatterns": [],
      "related": [
        {
          "name": "Bullet",
          "relationship": "alternative",
          "reason": "Use when a target marker and qualitative bands are needed"
        },
        {
          "name": "Kpi",
          "relationship": "alternative",
          "reason": "Use for a headline metric without a bounded range"
        }
      ],
      "a11yRationale": "Renders with role=\"meter\" exposing min, max, and current value to assistive tech.",
      "flexibility": []
    }
  }
}
